<xs:schema xmlns:xs="http://www.w3.org/2001/XMLSchema"
           targetNamespace="https://w3schools.com"
           xmlns="https://w3schools.com"
           elementFormDefault="qualified">
<xs:element name="libro">
  <xs:complexType>
  <xs:sequence>
    <xs:element name="titulo" type="xs:string"/>
    <xs:element name="autor" type="xs:string"/>
    <xs:element name="personaje" minOccurs="0" maxOccurs="unbounded">
      <xs:complexType>
      <xs:sequence>
          <xs:element name="nombre" type="xs:string"/>
          <xs:element name="amigo" type="xs:string" minOccurs="0" maxOccurs="unbounded"/>
          <xs:element name="desde" type="xs:date"/>
       <xs:element name="calificacion" type="xs:string"/>
      </xs:sequence>
      </xs:complexType>
    </xs:element>
  </xs:sequence>
  <xs:attribute name="isbn" type="xs:string"/>
  </xs:complexType>
</xs:element>
</xs:schema>